timestamp	commit	skill	old_score	new_score	status	dimension	note	eval_mode
2026-10-02T19:48	baseline	cross-system-hub	-	69.5	baseline	-	d3/d4 工具失败无分支;等待用户的环节未标🛑;高风险问题回答偏空 runtime_warn=0	full_test_seq
2026-10-02T19:48	baseline	psyche	-	62.5	baseline	-	d4 无检查点标记;危机处理靠外链;路由失败无兜底 runtime_warn=0	full_test_seq
2026-10-02T19:48	baseline	tarot	-	67.8	baseline	-	d4 无检查点;流程无输入/输出;兜底只在子skill runtime_warn=0	full_test_seq
2026-10-02T19:48	baseline	tarot-draw-protocol	-	82.7	baseline	-	牌阵位置名未列;抽完即停不接释义 runtime_warn=0	full_test_seq
2026-10-02T19:48	baseline	tarot-card-meaning	-	68.5	baseline	-	d3 失败模式无if-then;d4 无检查点;逆位无选择规则 runtime_warn=0	full_test_seq
2026-10-02T19:48	baseline	tarot-spread-synthesis	-	78.5	baseline	-	d3 缺牌面不全分支;d9 黑名单仅3条 runtime_warn=0	full_test_seq
2026-10-02T19:48	baseline	tarot-projective-dialogue	-	66.9	baseline	-	d4 无检查点;缺情绪承接与收尾话术;d9 散落 runtime_warn=0	full_test_seq
2026-10-02T19:48	baseline	fortune	-	72.1	baseline	-	d3 工具失败无分支;无编号流程;本命年缺转换 runtime_warn=0	full_test_seq
2026-10-02T19:48	baseline	bazi-liunian	-	72.3	baseline	-	d3 工具失败无分支;d9 无独立黑名单 runtime_warn=0	full_test_seq
2026-10-02T19:48	baseline	astrology-transit	-	61.5	baseline	-	d3/d6 星盘无取数路径;d9 无独立黑名单 runtime_warn=0	full_test_seq
2026-10-02T19:48	baseline	ziwei-doushu	-	70.3	baseline	-	d3 部分命盘/无工具无分支;d9 散落 runtime_warn=0	full_test_seq
2026-10-02T19:48	baseline	zhouyi-divination	-	76	baseline	-	d4 无检查点;d3 工具失败/数字非法无分支;d9 散落 runtime_warn=0	full_test_seq
2026-10-02T20:04	r1	cross-system-hub	69.5	76.7	keep	d2/d3/d4	round1 delta=7.2	full_test_seq
2026-10-02T20:04	r1	psyche	62.5	75.5	keep	d2/d3/d4	round1 delta=13	full_test_seq
2026-10-02T20:04	r1	tarot	67.8	83.2	keep	d2/d3/d4	round1 delta=15.4	full_test_seq
2026-10-02T20:04	r1	tarot-draw-protocol	82.7	84.4	keep	d2/d3/d4	round1 delta=1.7	full_test_seq
2026-10-02T20:04	r1	tarot-card-meaning	68.5	76.6	keep	d2/d3/d4	round1 delta=8.1	full_test_seq
2026-10-02T20:04	r1	tarot-spread-synthesis	78.5	80.3	keep	d2/d3/d4	round1 delta=1.8	full_test_seq
2026-10-02T20:04	r1	tarot-projective-dialogue	66.9	79.1	keep	d2/d3/d4	round1 delta=12.2	full_test_seq
2026-10-02T20:04	r1	fortune	72.1	80.2	keep	d2/d3/d4	round1 delta=8.1	full_test_seq
2026-10-02T20:04	r1	bazi-liunian	72.3	79.6	keep	d2/d3/d4	round1 delta=7.3	full_test_seq
2026-10-02T20:04	r1	astrology-transit	61.5	71.5	keep	d2/d3/d4	round1 delta=10	full_test_seq
2026-10-02T20:04	r1	ziwei-doushu	70.3	77.5	keep	d2/d3/d4	round1 delta=7.2	full_test_seq
2026-10-02T20:04	r1	zhouyi-divination	76	82.6	keep	d2/d3/d4	round1 delta=6.6	full_test_seq
2026-10-02T20:10	r2	cross-system-hub	76.7	79.1	keep	d9	round2 delta=2.4	full_test_seq
2026-10-02T20:10	r2	psyche	75.5	77.5	keep	d9	round2 delta=2	full_test_seq
2026-10-02T20:10	r2	tarot	83.2	82	revert	d9	round2 delta=-1.2	full_test_seq
2026-10-02T20:10	r2	tarot-draw-protocol	84.4	87.3	keep	d9	round2 delta=2.9	full_test_seq
2026-10-02T20:10	r2	tarot-card-meaning	76.6	83.8	keep	d9	round2 delta=7.2	full_test_seq
2026-10-02T20:10	r2	tarot-spread-synthesis	80.3	83.8	keep	d9	round2 delta=3.5	full_test_seq
2026-10-02T20:10	r2	tarot-projective-dialogue	79.1	81.7	keep	d9	round2 delta=2.6	full_test_seq
2026-10-02T20:10	r2	fortune	80.2	83.9	keep	d9	round2 delta=3.7	full_test_seq
2026-10-02T20:10	r2	bazi-liunian	79.6	83.9	keep	d9	round2 delta=4.3	full_test_seq
2026-10-02T20:10	r2	astrology-transit	71.5	80	keep	d9	round2 delta=8.5	full_test_seq
2026-10-02T20:10	r2	ziwei-doushu	77.5	85.1	keep	d9	round2 delta=7.6	full_test_seq
2026-10-02T20:10	r2	zhouyi-divination	82.6	86.2	keep	d9	round2 delta=3.6	full_test_seq
2026-10-02T20:13	r3	cross-system-hub	79.1	83.9	keep	d5/d8	round3 delta=4.8	full_test_seq
2026-10-02T20:13	r3	psyche	77.5	82	keep	d5/d8	round3 delta=4.5	full_test_seq
2026-10-02T20:13	r3	tarot	83.2	83	revert	d5/d8	round3 delta=-0.2	full_test_seq
2026-10-02T20:13	r3	tarot-draw-protocol	87.3	88.3	keep	d5/d8	round3 delta=1	full_test_seq
2026-10-02T20:13	r3	tarot-card-meaning	83.8	83.7	revert	d5/d8	round3 delta=-0.1	full_test_seq
2026-10-02T20:13	r3	tarot-spread-synthesis	83.8	82	revert	d5/d8	round3 delta=-1.8	full_test_seq
2026-10-02T20:13	r3	tarot-projective-dialogue	81.7	82.7	keep	d5/d8	round3 delta=1	full_test_seq
2026-10-02T20:13	r3	fortune	83.9	83.2	revert	d5/d8	round3 delta=-0.7	full_test_seq
2026-10-02T20:13	r3	bazi-liunian	83.9	86.2	keep	d5/d8	round3 delta=2.3	full_test_seq
2026-10-02T20:13	r3	astrology-transit	80	83.9	keep	d5/d8	round3 delta=3.9	full_test_seq
2026-10-02T20:13	r3	ziwei-doushu	85.1	83.3	revert	d5/d8	round3 delta=-1.8	full_test_seq
2026-10-02T20:13	r3	zhouyi-divination	86.2	82.6	revert	d5/d8	round3 delta=-3.6	full_test_seq
2026-10-02T20:21	r4	cross-system-hub	73.9	79.1	keep	AB	blind A/B x2 judges, both prefer new; scores=mean of 2 judges	full_test_ab
2026-10-02T20:21	r4	psyche	79.1	81.2	keep	AB	blind A/B x2 judges, both prefer new; scores=mean of 2 judges	full_test_ab
2026-10-02T20:21	r4	tarot	74.0	82.2	keep	AB	blind A/B x2 judges, both prefer new; scores=mean of 2 judges	full_test_ab
2026-10-02T20:21	r4	tarot-draw-protocol	81.3	86.5	keep	AB	blind A/B x2 judges, both prefer new; scores=mean of 2 judges	full_test_ab
2026-10-02T20:21	r4	tarot-card-meaning	76.5	82.3	keep	AB	blind A/B x2 judges, both prefer new; scores=mean of 2 judges	full_test_ab
2026-10-02T20:21	r4	tarot-spread-synthesis	79.0	84.2	keep	AB	blind A/B x2 judges, both prefer new; scores=mean of 2 judges	full_test_ab
2026-10-02T20:21	r4	tarot-projective-dialogue	80.9	84.4	keep	AB	blind A/B x2 judges, both prefer new; scores=mean of 2 judges	full_test_ab
2026-10-02T20:21	r4	fortune	78.5	86.6	keep	AB	blind A/B x2 judges, both prefer new; scores=mean of 2 judges	full_test_ab
2026-10-02T20:21	r4	bazi-liunian	77.6	83.4	keep	AB	blind A/B x2 judges, both prefer new; scores=mean of 2 judges	full_test_ab
2026-10-02T20:21	r4	astrology-transit	77.8	83.1	keep	AB	blind A/B x2 judges, both prefer new; scores=mean of 2 judges	full_test_ab
2026-10-02T20:21	r4	ziwei-doushu	78.0	83.8	keep	AB	blind A/B x2 judges, both prefer new; scores=mean of 2 judges	full_test_ab
2026-10-02T20:21	r4	zhouyi-divination	79.7	88.6	keep	AB	blind A/B x2 judges, both prefer new; scores=mean of 2 judges	full_test_ab
2026-10-02T20:29	r5	cross-system-hub	73.0	79.4	keep	AB	blind A/B x2, both prefer new (zhouyi: 1 tie + 1 new)	full_test_ab
2026-10-02T20:29	r5	psyche	77.4	81.8	keep	AB	blind A/B x2, both prefer new (zhouyi: 1 tie + 1 new)	full_test_ab
2026-10-02T20:29	r5	tarot	77.8	83.0	keep	AB	blind A/B x2, both prefer new (zhouyi: 1 tie + 1 new)	full_test_ab
2026-10-02T20:29	r5	tarot-draw-protocol	83.1	85.7	keep	AB	blind A/B x2, both prefer new (zhouyi: 1 tie + 1 new)	full_test_ab
2026-10-02T20:29	r5	tarot-card-meaning	83.8	85.6	keep	AB	blind A/B x2, both prefer new (zhouyi: 1 tie + 1 new)	full_test_ab
2026-10-02T20:29	r5	tarot-spread-synthesis	78.1	82.5	keep	AB	blind A/B x2, both prefer new (zhouyi: 1 tie + 1 new)	full_test_ab
2026-10-02T20:29	r5	tarot-projective-dialogue	77.7	82.3	keep	AB	blind A/B x2, both prefer new (zhouyi: 1 tie + 1 new)	full_test_ab
2026-10-02T20:29	r5	fortune	83.8	86.7	keep	AB	blind A/B x2, both prefer new (zhouyi: 1 tie + 1 new)	full_test_ab
2026-10-02T20:29	r5	bazi-liunian	77.3	83.5	keep	AB	blind A/B x2, both prefer new (zhouyi: 1 tie + 1 new)	full_test_ab
2026-10-02T20:29	r5	astrology-transit	77.0	82.2	keep	AB	blind A/B x2, both prefer new (zhouyi: 1 tie + 1 new)	full_test_ab
2026-10-02T20:29	r5	ziwei-doushu	80.0	83.5	keep	AB	blind A/B x2, both prefer new (zhouyi: 1 tie + 1 new)	full_test_ab
2026-10-02T20:29	r5	zhouyi-divination	84.1	84.7	keep	AB	blind A/B x2, both prefer new (zhouyi: 1 tie + 1 new)	full_test_ab
2026-10-02T20:37	r6	psyche	80.3	83.9	keep	AB	blind A/B x2, both prefer new	full_test_ab(d8 dry-run)
2026-10-02T20:37	r6	tarot	78.4	85.0	keep	AB	blind A/B x2, both prefer new	full_test_ab(d8 dry-run)
2026-10-02T20:37	r6	tarot-draw-protocol	83.1	87.3	keep	AB	blind A/B x2, both prefer new	full_test_ab(d8 dry-run)
2026-10-02T20:37	r6	tarot-card-meaning	80.8	83.1	keep	AB	blind A/B x2, both prefer new	full_test_ab(d8 dry-run)
2026-10-02T20:37	r6	tarot-spread-synthesis	80.0	84.2	keep	AB	blind A/B x2, both prefer new	full_test_ab(d8 dry-run)
2026-10-02T20:37	r6	tarot-projective-dialogue	81.1	85.5	keep	AB	blind A/B x2, both prefer new	full_test_ab(d8 dry-run)
2026-10-02T20:37	r6	fortune	84.2	88.6	keep	AB	blind A/B x2, both prefer new	full_test_ab(d8 dry-run)
2026-10-02T20:37	r6	bazi-liunian	76.5	82.9	keep	AB	blind A/B x2, both prefer new	full_test_ab(d8 dry-run)
2026-10-02T20:37	r6	astrology-transit	80.4	83.2	keep	AB	blind A/B x2, both prefer new	full_test_ab(d8 dry-run)
2026-10-02T20:37	r6	ziwei-doushu	79.0	86.5	keep	AB	blind A/B x2, both prefer new	full_test_ab(d8 dry-run)
2026-10-02T20:37	r6	zhouyi-divination	82.7	87.9	keep	AB	blind A/B x2, both prefer new	full_test_ab(d8 dry-run)
2026-10-02T20:37	r6	cross-system-hub	-	-	split-not-adopted	Phase2.5 rewrite v4	judge1 v4 79.8>78.1; judge2 old 82.8>80.8; v4 dropped rules	full_test_ab
2026-10-02T20:45	r7	cross-system-hub	76.2	80.5	keep	AB	blind A/B x2, both prefer new	full_test_ab(d8 dry-run)
2026-10-02T20:45	r7	psyche	80.3	82.0	keep	AB	blind A/B x2, both prefer new	full_test_ab(d8 dry-run)
2026-10-02T20:45	r7	tarot	77.6	81.7	keep	AB	blind A/B x2, both prefer new	full_test_ab(d8 dry-run)
2026-10-02T20:45	r7	tarot-draw-protocol	82.8	85.7	keep	AB	blind A/B x2, both prefer new	full_test_ab(d8 dry-run)
2026-10-02T20:45	r7	tarot-card-meaning	80.7	84.0	keep	AB	blind A/B x2, both prefer new	full_test_ab(d8 dry-run)
2026-10-02T20:45	r7	fortune	76.0	81.3	keep	AB	blind A/B x2, both prefer new	full_test_ab(d8 dry-run)
2026-10-02T20:45	r7	zhouyi-divination	81.6	83.1	keep	AB	blind A/B x2, both prefer new	full_test_ab(d8 dry-run)
2026-10-02T20:45	r7	bazi-liunian	79.8	82.8	keep	AB	blind A/B x2, both prefer new	full_test_ab(d8 dry-run)
2026-10-02T20:45	r7	astrology-transit	77.8	82.2	keep	AB	blind A/B x2, both prefer new	full_test_ab(d8 dry-run)
2026-10-02T20:45	r7	ziwei-doushu	80.7	81.9	keep	AB	blind A/B x2, both prefer new	full_test_ab(d8 dry-run)
2026-10-02T20:54	final-eval-1	cross-system-hub	-	81.5	measured	d8=7.7	real execution: with-skill vs baseline executors, blind output rating x2 judges; structural dims from SKILL.md	full_test_real
2026-10-02T20:54	final-eval-1	psyche	-	79.3	measured	d8=6.8	real execution: with-skill vs baseline executors, blind output rating x2 judges; structural dims from SKILL.md	full_test_real
2026-10-02T20:54	final-eval-1	tarot	-	81.9	measured	d8=7.5	real execution: with-skill vs baseline executors, blind output rating x2 judges; structural dims from SKILL.md	full_test_real
2026-10-02T20:54	final-eval-1	tarot-draw-protocol	-	83.3	measured	d8=7.0	real execution: with-skill vs baseline executors, blind output rating x2 judges; structural dims from SKILL.md	full_test_real
2026-10-02T20:54	final-eval-1	tarot-card-meaning	-	80.4	measured	d8=7.0	real execution: with-skill vs baseline executors, blind output rating x2 judges; structural dims from SKILL.md	full_test_real
2026-10-02T20:54	final-eval-1	tarot-spread-synthesis	-	84.5	measured	d8=7.5	real execution: with-skill vs baseline executors, blind output rating x2 judges; structural dims from SKILL.md	full_test_real
2026-10-02T20:54	final-eval-1	tarot-projective-dialogue	-	80.5	measured	d8=7.0	real execution: with-skill vs baseline executors, blind output rating x2 judges; structural dims from SKILL.md	full_test_real
2026-10-02T20:54	final-eval-1	fortune	-	78	measured	d8=6.8	real execution: with-skill vs baseline executors, blind output rating x2 judges; structural dims from SKILL.md	full_test_real
2026-10-02T20:54	final-eval-1	bazi-liunian	-	80.1	measured	d8=6.5	real execution: with-skill vs baseline executors, blind output rating x2 judges; structural dims from SKILL.md	full_test_real
2026-10-02T20:54	final-eval-1	astrology-transit	-	82.9	measured	d8=7.0	real execution: with-skill vs baseline executors, blind output rating x2 judges; structural dims from SKILL.md	full_test_real
2026-10-02T20:54	final-eval-1	ziwei-doushu	-	82.5	measured	d8=7.8	real execution: with-skill vs baseline executors, blind output rating x2 judges; structural dims from SKILL.md	full_test_real
2026-10-02T20:54	final-eval-1	zhouyi-divination	-	84.7	measured	d8=8.0	real execution: with-skill vs baseline executors, blind output rating x2 judges; structural dims from SKILL.md	full_test_real
2026-10-02T22:10	final-eval-2	ALL(12)	-	83.2	measured	d8 7.5-8.75	r9 real execution vs reused baselines, 2 blind judges; hub 83.9 psyche 82.2 tarot 83.0 draw 84.1 card 81.0 spread 84.9 proj 83.8 zhouyi 86.9 fortune 79.0 bazi 82.7 astro 85.0 ziwei 82.3	full_test_real
2026-10-02T23:05	final-eval-3	ALL(12)	-	86.2	measured	d8 7.75-9.0	r10 real execution; hub 84.2 psyche 85.1 tarot 84.8 draw 85.4 card 86.1 spread 86.1 proj 83.8 zhouyi 87.5 fortune 84.2 bazi 89.5 astro 90.3 ziwei 87.3	full_test_real
2026-10-03T00:20	final-eval-4	ALL(12)	-	86.7	measured	d8 8.0-9.0	r11 real execution; hub 81.3(count-rule conflict) psyche 86.8 tarot 87.3 draw 87.1 card 87.7 spread 85.6 proj 86.5 zhouyi 87.9 fortune 84.3 bazi 88.7 astro 88.9 ziwei 87.7	full_test_real
2026-10-03T01:30	final-eval-5	ALL(12)	-	86.2	measured	d8 8.0-8.75	r12 real execution (zhouyi e1 pair mismatched prompts); hub 84.4 psyche 87.1 tarot 85.6 draw 87.3 card 85.3 spread 85.1 proj 87.2 zhouyi 87.5 fortune 85.3 bazi 86.3 astro 87.5 ziwei 85.3	full_test_real
2026-10-03T03:00	final-eval-6	ALL(12)	-	87.0	measured	d8 8.25-9.0	r13 real execution; hub 85.2 psyche 88.9 tarot 86.3 draw 87.2 card 85.5 spread 85.4 proj 87.5 zhouyi 88.5 fortune 84.7 bazi 88.1 astro 87.9 ziwei 89.1	full_test_real
2026-10-03T04:40	final-eval-7	ALL(12)	-	85.8	measured	d8 7.75-9.0	r14 real execution (ziwei e1 regenerated to match baseline prompt; one judge's day-pillar objection verified wrong: 1992-11-03=癸未); hub 85.6 psyche 85.3 tarot 85.3 draw 86.0 card 83.9 spread 85.6 proj 89.1 zhouyi 88.5 fortune 83.3 bazi 84.7 astro 85.8 ziwei 86.9	full_test_real
2026-10-03T07:00	final-eval-8	ALL(12)	-	86.6	measured	d8 8.0-8.75	r15 real execution; hub 85.2 psyche 88.3 tarot 84.3 draw 88.6 card 85.5 spread 86.6 proj 86.4 zhouyi 88.0 fortune 85.6 bazi 87.2 astro 85.5 ziwei 87.6	full_test_real
2026-10-03T09:30	final-eval-9	ALL(12)	-	85.7	measured	d8 7.75-8.88	r16 final real execution; hub 84.0 psyche 88.2 tarot 86.5 draw 88.0 card 82.1 spread 83.1 proj 86.6 zhouyi 88.8 fortune 84.3 bazi 85.9 astro 85.6 ziwei 85.4; last-4-round mean 86.3; target 90 not reached (plateau)	full_test_real
2026-10-03T13:30	final-eval-10	ALL(12)	-	86.8	measured	median of 3 judges, 3 prompts/skill	r17 stricter eval; hub 84.5 psyche 89.1 tarot 86.4 draw 85.6 card 87.9 spread 85.5 proj 87.2 zhouyi 86.4 fortune 86.4 bazi 86.4 astro 87.1 ziwei 89.1	full_test_real_v2
2026-10-03T16:30	final-eval-11	ALL(12)	-	86.4	measured	median of 3 judges, 3 prompts/skill	r18 pillars lookup + one-question rule; hub 83.9 psyche 88.5 tarot 87.5 draw 87.1 card 86.3 spread 85.4 proj 86.0 zhouyi 86.4 fortune 85.6 bazi 87.1 astro 87.9 ziwei 85.4 (within noise of r17)	full_test_real_v2
